{
  "schema_version": 1,
  "authority": "ourd.egcf.catalog.command_catalog",
  "description": "Data-driven EGCFv1 semantic command catalog. Runtime registration uses the same checked-in namespace and override definitions.",
  "namespaces": {
    "capability": ["list", "describe", "graph", "check", "request", "grant", "revoke", "audit", "explain"],
    "hrt": ["interpret", "assumptions", "ambiguity", "clarify", "claims", "provenance", "summary", "explain"],
    "ourd": ["model", "objects", "relations", "boundaries", "dependencies", "impact", "trace", "scope", "exclusions", "graph"],
    "iurm": ["dimensions", "baseline", "vary", "screen", "interactions", "sensitivity", "mvd", "optimise"],
    "ieps": ["generate", "coverage", "oracle", "counterexamples", "uniqueness", "mutation", "shrink", "qualify", "gate"],
    "eon": ["draft", "validate", "compile", "simulate", "authorise", "execute", "rollback", "compare"],
    "algorithm": ["register", "search", "compare", "qualify", "benchmark", "compose", "evolve", "retire", "explain", "select"],
    "evidence": ["collect", "classify", "compare", "graph", "export", "confidence", "conflicts", "history"],
    "invariant": ["discover", "register", "validate", "compare", "conflicts", "supersede"],
    "internet-improvement": ["plan", "run-once", "resume", "run-status", "explain-action"],
    "decision": ["create", "query", "history", "supersede", "explain", "conflicts"],
    "debug": ["reproduce", "minimise", "bisect", "hypotheses", "trace", "compare", "rootcause", "verify"],
    "experiment": ["design", "ofat", "factorial", "covering", "benchmark", "analyse", "repeat", "compare"],
    "verify": ["unit", "integration", "property", "fuzz", "mutation", "differential", "metamorphic", "regression", "performance", "security"],
    "simulate": ["worktree", "migration", "dependency", "api", "hardware", "filesystem", "network", "chaos", "rollback"],
    "performance": ["profile", "benchmark", "hotspots", "regression", "memory", "gpu", "io"],
    "security": ["threat-model", "taint", "sast", "secrets", "permissions", "provenance", "sbom", "audit"],
    "repo": ["graph", "symbols", "ownership", "history", "evolution", "metrics", "hotspots", "timeline"],
    "workflow": ["create", "compile", "execute", "pause", "resume", "replay", "branch", "merge", "monitor"],
    "agent": ["spawn", "specialise", "debate", "review", "critic", "merge", "consensus", "terminate"],
    "cfel": ["observe", "classify", "compare", "diagnose", "recover", "learn", "stability", "regression"],
    "assurance": ["generate"],
    "physics": ["simulate"],
    "geometry": ["analyse", "fit", "optimise"],
    "grammar": ["parse", "transform", "compare", "verify"],
    "vision": ["detect", "segment", "track"],
    "robotics": ["plan", "verify"],
    "cad": ["mesh", "topology", "simplify", "validate"]
  }
}
